{
  "inconclusive_policy": "fail",
  "kind": "hotato.suite",
  "name": "Reference agent -- full conversation-QA suite",
  "purpose": "25 realistic voice-agent jobs x 5 caller behaviours x 3 audio environments = 375 offline simulated runs, scored across the outcome / policy / conversation / speech dimensions.",
  "required_for_release": true,
  "suite_id": "reference-agent-suite",
  "tests": [
    "tests/angry-caller-deescalate-refund.test.json",
    "tests/appointment-book-basic.test.json",
    "tests/appointment-cancel-after-cutoff.test.json",
    "tests/appointment-reschedule.test.json",
    "tests/backchannel-heavy-address-change.test.json",
    "tests/escalate-not-handed-off.test.json",
    "tests/escalate-to-human-supervisor.test.json",
    "tests/faq-store-hours.test.json",
    "tests/identity-skipped-before-lookup.test.json",
    "tests/identity-verify-success.test.json",
    "tests/interruption-correct-date.test.json",
    "tests/log-complaint.test.json",
    "tests/make-payment.test.json",
    "tests/password-reset.test.json",
    "tests/payment-declined-handled-wrong.test.json",
    "tests/prescription-refill.test.json",
    "tests/refund-claimed-not-issued.test.json",
    "tests/refund-damaged-order.test.json",
    "tests/refund-partial.test.json",
    "tests/restaurant-reservation.test.json",
    "tests/schedule-callback.test.json",
    "tests/shipping-address-correction.test.json",
    "tests/subscription-cancel.test.json",
    "tests/warranty-claim.test.json",
    "tests/wrong-number-polite-exit.test.json"
  ],
  "version": 1
}
